text,likesCount
""" Animalismo da facciata "".
Il problema del  cane Numb  , gentile dottoressa,  non  quante volte sia stato aperto per il sieroma, non  quante volte sia stato portato in vetta,  non  la genetica del cane , non  che il signor Colussa non voglia bene al suo cane , tutt'altra cosa credo gli voglia un bene dell'anima e lo ha dimostrato chiaramente. Posso asserire ci  con determinazione perch  lo seguo da alcuni anni e ho visto, tramite video,  il cane Numb prima e dopo le sue disgrazie ,  un cane che  sempre stato trattato benissimo. Inoltre , personalmente ,  ci tengo qui a dire che non ho mai augurato la morte a nessun veterinario .....ma ritengo giusto e doveroso che sia fatta chiarezza,  perch le ingiustie non le sopporto a prescindere dal fatto che  il signor Colussa a volte si sia espresso con un  linguaggio troppo acceso,  ma il suo linguaggio non  altro che il prodotto della sua pi che giusta e comprensibile esasperazione. Detto questo,  gentile dottoressa,  lei ha molto abilmente soprasseduto sul punto focale di tutta questa pazzesca situazione e cio, che tutte le situazioni pesanti di salute,  che il cane Numb ha subito e dovuto sopportare insieme al signor Colussa , nascono dal fatto , che la genesi  di tutti i problemi di non salute del cane , sia dovuta ad un'infezione dentale del cane. Lei sapr benissimo come un'infezione mal curata che rimane all'interno dell'osso mandibolare   in quanto il dente  stato poi richiuso,  possa essere causa di innumerevoli problemi gravi di salute che vanno da  ....una setticemia che pu portare il paziente,  nel giro anche di  brevissimo tempo, giorni ,  a morte certa, come a una serie di patologie anche molto invalidanti  come  appunto la POLIARTRITE REUMATICA . La genetica qui c'entra poco o nulla. La medicina sta facendo ormai  passi da gigante nel campo delle malattie autoimmuni e reumatiche,  ponendo l'attenzione sul fatto che hanno sempre un origine infettiva che sia di naturale virale o batterica poco importa ma di fatto ...  infezioni che se mal  curate e non  risolte con idonee terapie possono causare danni enormi. E questo direi che  proprio il caso del cane Numb ,  l'infezione al dente, non solo non  stata immediatamente risolta dentisticamente parlando , ma addirittura successivamente non   diagnostica, non vista. In questo modo il germe patogeno e responsabile dell'infezione,  se ricordo bene un ceppo di Stafilococco altamente resistente anche a cocktail di antibiotici, ha avuto modo , attraverso il torrente circolatorio , di raggiungere altri distretti corporei nel corso dei mesi successivi all'intervento dentistico,  e raggiungere il midollo spinale e sicuramente altre zone dell'organismo del cane . C' stato tutto il tempo per sviluppare, da parte del sistema immunitario ormai impazzito del cane Numb ,  una poliartrite reumatica . Malattia autoimmune reumatologica diagnostica solo successivamente e curata con dosi massicce di cortisonici , che come lei giustamente  asserisce,  hanno portato indebolimento della massa muscolare del cane , delle sue ossa e quindi hanno provocato un danno al cane stesso durante le sue attivit fisiche, causando la formazione di   ernie fuoriuscite dalla colonna vertebrale . Ma la responsabilit  di tutto ci,  gentile dottoressa,  di chi .....? Non   certo attribuibile ad una persona che non sa nulla di.medicina veterinaria ,  cio il signor Colussa , il quale si  affidato come tutti noi avremmo fatto alle cure di uno o pi vetrinari , in buona fede ha messo la salute e la vita del suo cane Numb nelle mani di quelli che da specialisti avrebbero dovuto capire sin dall'inizio la causa della malattia del cane  e agire tempestivamente con cure adeguate al ripristino dello stato di salute del cane . Non si pu incolpare dell'accaduto il  proprietario del cane , il signor Colussa non  veterinario non poteva sapere degli effetti collaterali del cortisone cos come non poteva sapere l'origine della poliartrite reumatica del suo cane , si  affidato  agli specialisti  e si  fidato delle diagnosi e delle cure che dai medesimi sono state prescritto al cane Numb . Il cane Numb e il signor Colussa sono le vittime di questa assurda situazione. Sicuramente personalmente l'avrei gestita diversamente ma  facile parlare quando non si  direttamente coinvolti. I cani sono esseri troppo intelligenti per non pensare a loro come fossero persone che fanno parte  delle nostre famiglie e pertanto  giusto indignarsi,   umano arrabbiarsi,   umano perdere il controllo in certe situazioni usando a tratti un linguaggio troppo acceso . Ma al posto di Colussa, chi qui scrive,  cosa avrebbe fatto e come si sarebbe comportato quando dopo aver speso un pacco di soldi, ti ritrovi con il cane che tanto ami in condizioni di salute veramente precarie .....? Bisogna farsele due domande,  prima di condannare chi ha solo cercato di far curare al meglio il proprio cane .
Cordiali saluti.",4
"Certi commenti fanno veramente rabbrividire.......io vi denuncerei........cmq errare   umano succede negli ospedali e succede anche nelle cliniche veterinarie.1 una clinica di solito   H 24 qui nella mia zona c' ne sono due,sempre aperte,di notte c'  l echip completa.,se c' bisogno di intervento operano.2 se Colussa come dite,ha sfondato come dite ,forse era troppo tempo che provava a chiedere notizie ,ma con nessun risultato? L avrei fatto anche io,che non sono Thomas Colussa,e non ho Numb,ma il mio cane anche meticcio.cliniche che costano fior di soldi..........allora bisogna essere all altezza con personale e tutto quello che serve..........e se non siete,soddisfatti dello stipendio,andate a fare un altro lavoro,o in una clinica che vi paga meglio.ma ricordatevi x chi ama gli animali x noi sono figli!!!!!!!!!",3
Grande giulia!lo hai fatto nero!!,0
La setta segue il santone senza manco capire di cosa si parla  ma normale quando sono convinti che un clc  un cane da scalata di montagna lanatomia questa sconosciuta  dov lamore di cui tanto parlano? Qui passerai tu come cattiva invidiosa e dio solo sa cosaltro quando invece basterebbe usare quei neuroni di cui siamo dotati e credere ad un professionista del settore e non ad un quaquaraqua,6
Alessandro Ceffa bravissimo,9
"Alessandro Ceffa ecco la prima cazzata lhai sparata tu nei commenti, ottimo",13
"Carlo Costa il tuo commento  estremamente preoccupante, quello che dice Alessandro  puro buon senso.",17
Alessandro Ceffa hai confuso la   con il cioccolato.,1
"Cinzia Muzzi Tranquilla, so riconoscere dall'odore. Se vuoi confutare quanto ho scritto e avere una pietanza diversa bene, altrimenti continua a mangiare quella a cui sei abituata.",0
"Carlo Costa Se vuoi rispondere nel merito invece di dare giudizi non supportati da alcunch sei il benvenuto, altrimenti taci.",2
Alessandro Ceffa poraccio,0
Cinzia Muzzi siete troppo abituati alla merda che vi propina Colussi che fa tanto il coraggioso e poi chiude i commenti .,1
Cinzia Muzzi quindi? Argomentiamo o ci fermiamo alle ingiurie?,1
"Giulia Corsini ma bravissimo cosa??? Numb  sempre stato in piena sicurezza e Thomas Colussa  il primo che promuove cultura alpinistica e sicurezza per cane e umano, denunciando chi affronta la montagna senza le corrette precauzioni e le giuste attrezzature!!! Dottoressa Giulia Corsini lei pi che interessata al mondo animale mi sembra interessata a fare la giudice sui social, denigrando generazioni, persone e fatti che lei non condivide e in realt neanche conosce.",0
"Parla cosi perch non sa cosa significa Numb per Thomas Colussa !!! Quell'uomo vive per il suo cane!! Il fatto che Numb abbia avuto grossi problemi di salute non  di certo per colpa dell'attivit fisica fatta, ma di una serie di ""veterinari "" che non sa fare il proprio lavoro.",4
Sofia Occhiena lamore  irrilevante. In questo caso (forse) pure dannoso.,2
Stefano Mestici ma che ne saiiii &,0
Danilandia Danila Sicuramente ne so pi di lei e di quel canicida,1
Sofia Occhiena amare il proprio cane significa anche rispettare i suoi limiti fisici imposti dalle sue condizioni di salute al momento,0
se ci tieni a un individuo non minacci chi lo cura.,7
Patricia Natalia Cuevas guardi ma xk non si prende una laurea in veterinaria ??? 	 cos se lo fa lei,2
Sei una persona socialmente pericolosa.,1
Kika Cerolini che risposta   non ho capito ! Ma lasciamo perdere va !!,0
Patricia Natalia Cuevas appunto NON CAPISCE.... ###,1
"Giulia Corsini se ci tieni alla tua vita curi chi lascio nelle tue mani come si deve, e mi fai sapere tutto quello che  necesario sapere spesso vi nascondete dietro a molte scuse che a me non interessano non ce la fai me lo dici subito e me lo porto via ...poi sarei curiosa di sapere cosa invece pensi di tutte le testimonianze raccolte su questa clinica ...perch commentare solo il caso di numb ? Se vai a vedere altri video ci sono altre testimonianze di come hanno tratto altri cani commenti pure quelli ? O sono meno importanti? Guarda io non sono di parte seguo loro come altri non commento quasi mai, ma quando ci sono certi video mi sale la carogna.   ho 4 cani una di loro ha 9 anni al eta di 5 ho sentito nel suo battito qualcosa che non andava il veterinario mi ha detto che per lui era tutto normale mi sono agitata un po' anche perche non navigo nel oro e lo sanno benissimo e quindi mi voleva mandare via cosi . Ho dovuto insistere per farli fare almeno un ecografia. Mi ha detto che non era necessario io ho alzato la voce e lui mi ha risposto va bene faccio i raggi caso mai che costa meno, costa meno ? Ma chi cazzo se ne frega ti ho chiesto qualcosa ? Ti devo qualcosa piuttosto mangio la merda , fatto sta che dai raggi e risultato che aveva il cuore piu grosso del normale quando  tornato mi ha detto si forse aveva ragione !  In quel momento ho pensato sto bastardo ha pensato che da me non avrebbe ricavato granch!  Ovviamente non mi ha piu visto. Sono andata in un altra clinica e da un ecografia risulta che oltre al cuore ingrossato ha un foro ventricolare. Ora se non fosse stato perche ho alzato la voce io sarei tornata a casa tranquilla di quello che mi ha detto il cazzo di professionista.  l esperienza mi dici che con molti di voi se non alzi la voce e non ti fai valere chi ci rimette  l animale ! E ne potrei raccontare per cosi !",0
Roberta Lo Pinto invidia brutta bestia,3
"Marco Muratori avoja invidia di aver spaccato il mio cane uhhhh 
Ma la bocca ce lavete collegata al cervello? O vi manca proprio quello?",0
Roberta Lo Pinto non sai di cosa parli...come la dottoressa...braaaaaaavaaaa,0
Roberta Lo Pinto cinofili...---,0
Ahahahahahah come ci si umilia per un po' di visibilit... Mamma mia! Il testo che hai letto da chi  stato scritto da quelli della San Marco? Se si spero ti abbiano pagato bene. Dopo sta buffonata. Addio!,19
"Ma immaginate che io voglio sapere se il mio cane  vivo e nessuno mi dice niente. Io avrei fatto anche peggio. Perch non gli hanno detto niente?? Lo hanno voluto portare allo sfinimento allesaurimento per potersi liberare di lui? Io la vedo cosi.
E sotto organico non deve esistere in nessuna sanit n privata n pubblica n da umani n da animali !!",6
"In tutto questo non hai compreso la cosa pi importante, ovvero che non hai la minima idea di cosa significhi Numb per Thomas.
In pi non ti  chiaro che i problemi di salute di Numb sono iniziati per incompetenza di Veterinari.
Numb era un cane sanissimo e in forma e chi lo ha rovinato non  certo Thomas.
 facile fare debunking, il difficile  farlo dalla parte giusta della verit.",77
"Ha dei grossi problemi comportamentali, per non parlare del linguaggio.",1
Secondo voi l'ex cuoco potr mai dire che  stata colpa sua???,3
"Infatti, poi l'infezione c' stata causando tutto ci che ha causato..",1
"Se vuoi tranquillizzare un cliente mandi foto e video che il cane sta bene. Ci vuole 1 minuto!!! E nessuno lo ha fatto perch per me non lo hanno voluto fare. 
Poi.
Pu capitare un sieroma?
Si pu capitare
SENONSEIATTENTO e TENEFREGHI come  stato fatto con questo cane.
Il comportamento nei confronti di Numb doveva essere un altro.
Al di l della simpatia o antipatia che si pu avere verso il suo proprietario. 
Io percepisco che invece si sono state fatte scelte sul personale. 
In ogni caso 
Veterinario non morde mai un altro veterinario si cerca sempre di giustificare le scelte del collega.",4
Lei  a favore della sperimentazione animale? Giulia Corsini attendo una sua risposta,0
"Ma Sherlock Holmes spostati proprio # Qua non si tratta nemmeno dignoranza nuda cruda, qua secondo me cara mia veterinaria  il fatto  che sei proprio stupida. Ma stupida stupida",58
NNNN,1
No.,16
"Giulia Corsini da professionista del mestiere se voleva aiutare Numb poteva farsi avanti prima!
Cos facendo si capisce che  in cerca di visibilit 7",5
Giulia Corsini beh sarebbe ora che imparassi a farteli!!,2
Giuseppe Orlando perch senn?,0
Giulia Pedra senn Giuseppe piange e pesta i piedini.,1
Giulia Corsini andare contro Thomas Colussa non ti fa fare bella figura sai???,0
Marco Muratori invece fa benissimo. E la brutta figura la fa lui che continua a scrivere insulti sessisti e abilisti. Basta un minuto di intelligenza per capire chi  dalla parte del torto,1
Giulia Pedra non ho chiesto la tua opinione,0
Marco Muratori e quindi? A nessuno interessa il tuo turpiloquio eppure sei sempre qui che scrivi.,0
"Alessandro Casapieri cio& una che legge un messaggio demenziale ,dopo avere iniziato questa stupida disputa con un post da alunna che si impegna poco &avrebbe fatto nero Colussa ????  Dice la veterinaria che lavora in Inghilterra , spero che arrivi fin li la pochezza dimostrata  finora e che i clienti prendano nota in che mani mettono i loro amati .",0
Loredana Zanatta stai serena che chi vede il video capisce benissimo da che parte stia la verit. E non certo dalla parte di uno che insulta e minaccia la gente,1
"Giulia Pedra  certo cara signora che chi vede il video capisce dove sta la verit , specialmente  se ha seguito questa spiacevole situazione dall'inizio , partito da un post denigratorio della pseudo veterinaria ai danni di Colussa , un post basato sul nulla , perch la signora che lo ha fatto (su sua ammissione )nulla sa degli antecedenti ,del vissuto , delle disavventure , del patimento  della vita di Thomas e Numb . Lei si  intromessa insultando e generalizzando e in cambio giustamente le sono arrivate insolenze . Ma se lei cara signora Petra si fosse trovata attaccata da una qualunque (che lei neppure sa della sua esistenza ),sulla sua vita personale e nei suoi affetti  come avrebbe reagito ?.. Questa  l'unica domanda a cui rispondere .",1
Mariella Lunardi che delirio,2
Mariella Lunardi anche tu avresti sfondato una porta per entrare a forza? Vuol dire che sei al suo stesso livello. Chi si somiglia si piglia.,0
"Davide Dellagnello io ti pago io voglio notizie,un ora due ore mezza giornata alla fine se non ho notizie qualcosa invento,alla pari guardi come parla.........a me non mi   successo mai! Perch  se non ho avuto risposte,mi hanno richiamato anche nella nottata.......nelle nostre cliniche no vip,c' la centralinista dove ti aggiorna.",0
Non solo la sala di attesa   sempre  aperta,0
"Mariella Lunardi tu paghi per far curare l'animale, non ti sei comprata la clinica n la professionalit di chi ci lavora. Le notizie le chiedi negli orari dovuti e il resto del tempo non scassi la minchia, perch la gente non  a disposizione tua.",1
Mariella Lunardialla pari?? Ma chi cazzo siete per pretendere notizie ad ogni ora!  Tu ti permetti di chiamare all'una di notte in ospedale? Ti permetti di chiamare ad ogni ora e fare perdere tempo alla gente che sta curando degli animali che magari sono in terapia intensiva?? Dovete chiamare negli orari prestabiliti ....e non rompere i coxxioni!!,2
"Mariella Lunardi accetto il commento, adesso per facciamo un parallelismo.
Ospedale umano. 
Puoi chiamare, non ti rispondono, ti avvisano se ci sono cambiamenti nello stato clinico di un paziente.
Clinica veterinaria, medesima cosa.
In entrambi i casi le due strutture sono pagate da lei, da una parte con le tasse, dallaltra privatamente.
Se non ci sono notizie di rilievo su un paziente STABILE, ci si sente al mattino, dopo che  stato rivalutato dal medico che lo segue.
A seguire in quasi tutte le cliniche che offrono un servizio H24, notte e festivi contano un organico ridotto, pronto tuttavia ad essere supportato in caso di necessit con le reperibilit del personale.
Questo per dare continuit al servizio, avere il polso di tutti i pazienti ricoverati, nellordine di priorit avvisare il proprietario, fuori orario, dopo aver stabilito accordi precisi,  insensato, sopratutto se parliamo di un paziente stabile.",0
Cos  l Echip ?,0
"Susanna Bria equipe ora   scritto bene manca l accento sulla e,mi cambia le parole.",1
Ah grazie,0
argomenta.,1
"Tessa Lulli e sono in troppi a farlo, gli animali ormai sono un mezzo per arrivare in politica o vivere alle spalle delle persone che glielo consentono con donazioni magari pure esentasse.
Parlo in generale perch basta aprire Fb che ne spuntano a bizzeffe, sottraendo inoltre offerte a chi di animali se ne occupa davvero.",0
Chiara Di Leonardo,0
....,1
"Se non sei iscritta ai veterinari la tua parola vale meno di niente anche se hai studiato,e poi che cosa ti viene in tasca facendo questo video? La clinica o chi per esso ti paga? Torna in Inghilterra e vai a curare i cani inglesi,ignorante!!!!",5
"Solidariet a te, ho gi scritto delle cose sul profilo di debunker.",2
"Povero cane, ovvio che ci metta tutto il suo impegno per fare contento il padrone/capo branco.
Certa gente dovrebbe rendersi conto delle proprie capacit di gestione di un animale ed empatia e, se proprio vuole un cane, comprarsi un bel peluche.",12
Addio cosa? Mica la seguivi.,11
Adriano Ziffer  un profilo aperto da poco giusto per un addio...,14
"Adriano Ziffer No non la seguivo, per curiosit sono finito qui ma non ho pi intenzione di sentire altre fesserie o interpretazioni pilotate che distorgono la verit dei fatti solo per attaccare senza una evidente competenza e veridicit un'altra persona. L'animalismo di  facciata  solo di questa dottoressa e ci sono prove evidenti che lo confermano",8
Diego Leva ahahahahahah simpaticissimo davvero degno di seguire questa dottoressa :-),4
"Francesco Consoli senza evidenza di capacit o competenza. Direi che fra voi due, l'unico che non ha dimostrato la minima capacit e competenza,  proprio lei.",6
Francesco Consoli continua a seguire che maltratta un animale per 4 spicci. Vergognati,4
Francesco Consoli chiss come mai vengono a scrivere solo canare 80enni e profili fake aperti da poco. A pensar male... ,6
"Baza De Fen intanto di vergognarsi lo dici ai tuoi genitori perch pur non conoscendoti di uno che spara cos a zero hanno ben ragione di vergognarsi
Poi uno non ha mai maltrattato il suo animale come hanno testimoniato o veterinari (quelli veri e bravi) ma sopratutto vergognati tu che segui una dottoressa vetrerinaria che  a favore della caccia che segue le lo bi di chi tortura gli animali e quant'altro Certo che questa dottoressa si permette di dire tante di quelle stupidaggini da far paura perch chi la segue  (come da te dostrato) privo di neuroni l!",3
"Francesco Consoli no devi vergognarti tu , continua a leccare il culo a chi sfrutta il suo animale fino a farlo star male per 4 spicci. Non seguo questa veterinaria son venuto a conoscenza per colpa di Colussa. E effettivamente io non sono veterinario n dottore e vedevo che Colussa non faceva altro che sfruttare allo sfinimento un povero animale e dopo questo le mie convinzione sono pure peggiorate",2
Baza De Fen ahahahahahah ma Ciaooo ho sprecato troppi minuti della mia vita per te.. Poveraccio tu si che mi fai pena ma d'altra parte chi nasce tondo non muore quadrato,2
Mirko Tedeschi ma quindi ha smesso di fare il cuoco? Qual  la fonte principale di guadagno ora? Ho come il presentimento di sapere gi la risposta a questa domanda.,2
Figurati,0
"Giulia Corsini le cose che vende per i cani ( guinzagli e via dicendo) di cui ogni volta ci tiene a raccontare il grande successo . Poi con le "" gite "" in montagna che organizza, penso anche dalle consulenze e dai video che fa' ( di questo non sono sicuro) . Comunque ha tirato fuori un buon business, proprio oggi ho visto un suo video in cui diceva che il suo cane  il suo socio della sua azienda, e non stava scherzando.....
Pito",1
Giulia Corsini il libro: fa i soldi col libro ed hal'ossessione che tu lo stia sfruttando per promuovere il tuo. ###,0
"Thomas Colussa invece guarda un p quello ""studiato"" qui sei tu....divulgatore di verit assoluta e di assoluta integrit....peccato che la signora Giulia Corsini sia persona ,come molti di noi, preparata e dotata di intelligenza e quindi capace di argomentare e smontare le mischiate che racconti....alle 4 gattare che ti seguono....vai a fare lo splendido da un altra parte....su.",14
"Dal punto di vista argomentativo sei davvero ma davvero scarso, Colussa. Non riesci a costruire un ragionamento e ti riduci a un repertorio di insulti puerili, con la stessa identica foga di un bambino di prima elementare arrabbiato perch gli hanno tolto la Playstation.",49
Sara Mas si e tutti quelli che hanno seguito e seguono Numb sono dei coglioni. Invece quella che s  sta qua che non lo ha mai visto e letto un referto. Ma datevi una svegliata razza di coglioni,22
Giulia Corsini perch si dovrebbe argomentare con una ritardata che batte i piedi volendo avere ragione sul nulla?,20
"Thomas Colussa  direi che la signora in questione abbia appena affermato, e neanche troppo tra le righe, che tutti i veterinari che hanno seguito Numb siano incompetenti..dal primo all'ultimo...mah...boh..",8
"Simona Bassi non ho affermato assolutamente questo, anzi!",13
"Thomas Colussa questo video esurreale Un debunking fatto non si sa a favore di chi, senza cartelle cliniche in mano. E poi ci sono quelli che la incensano come avesse detto chiss quale verit,  la salvatrice dei veterinari, anzi del mondo intero. fantastico Quasi quasi rimpiango i Malin Ma poi ho letto che si  paragonata alla Bruzzone e ai criminologi che vanno in tv#",11
Giulia Corsini no no tra le righe questo emerge chiaramente dato che qualsiasi attivit Thomas Colussa abbia fatto con Numb  sempre stata concordata con i veterinari che lo seguono e seguivano -anche quelli della san marco,9
Katia Stanzani Ghedini Piazza San Marco...			,2
"Tatiana Bergamaschi ma non ti preoccupare, 20 e pi vet che ci hanno sempre seguito fin da quando era cucciolo, tutti coglioni. Ora abbiamo la dr. House dei poveri che con 4 video, ha ricostruito 4 anni per filo e per segno. E gli altri muti#",18
"Simona Bassi Quando parli di infezione, a cosa ti riferisci esattamente? Allinfezione dentale? Perch c unincongruenza evidente: in un articolo attribuisce la poliartrite al bagaglio genetico, in un altro sostiene invece che sia stata causata dal dente, e questo mesi dopo. Ma se davvero la poliartrite autoimmune fosse stata scatenata da un foco settico, questo sarebbe emerso al momento della diagnosi di poliartrite autoimmune, perch si ricerca e si identifica il potenziale trigger infettivo come parte della diagnosi eziologica. Perch  ovvio che non puoi iniziare una terapia steroidea e basta se c' un foco settico, che peggiorerebbe, a causa del fatto che gli steroidi diminuiscono la risposta del sistema immunitario.",0
"Valeria Pisani iscritta all'albo INGLESE, capra !! # Ma lo capite che la vostra opinione non conta niente a fronte di ci che dice un professionista?",2
Giulia Pedra tra l'altro non posso lavorare in Italia non essendo iscritta all'Ordine italiano.,1
"Valeria Pisani  iscritta ad un ordine dei veterinari, quello inglese, ed ha studiato in Italia. Sta spiegando cosa ci si dovrebbe aspettare da un punto di vista clinico, anche con considerazioni generali. Chiaramente la parola di un professionista, anche se iscritto all'albo equivalente di un altro paese, ha un peso diverso perch sa di quello che parla. 
La scienza  uguale ovunque, basta che si portino le prove, e Giulia sta parlando basandosi su linee guida internazionali e casi clinici in generale.",1
"Valeria Pisani pensa, lo fa pure gratis senza che nessuno le chieda niente. 
Poi non so dove tu abbia sentito che non sia iscritta all'ordine",1
Cassandra Fraccaro io non riesco a capire come possano avere una capacit cos limitata nel capire cosa si dice.  avvilente.,0
Cassandra Fraccaro lo ha detto lei.,0
Giulia Pedra ah si sono pagato da colussa.... Mi fate morire dal ridere!!!,0
Francesco Consoli e tu sei nato triangolo. Continua a leccare il culo a chi maltratta un animale. Vergognati,3
Baza De Fen Ciccio ma hai imparato 2 pqlarolonw e le ripeti in continuazione perch non riesci a esprimerti in altro modo? Cucciolo capisco le tue difficolt dai dai magari se tra 1000 rinascerao ancora c' una buona possibilit che la fortuna 1 neurone la fortuna te lo doni... Ciao ciao,0
"Francesco Consoli comprensione del testo zero: non ho mai detto che sei pagato, ho scritto che il tuo profilo  finto e appena creato ad uno scopo preciso. 
Vista la comprensione mi farei due domande",5
"Francesco Consoli sarebbe bello sapere che sei pagato, almeno la tua presenza qui avrebbe un senso.",3
Francesco Consoli sei in grado di contraddire la dottoressa?,3
"Francesca Trillini io si, secondo i principi dei comitati etici, quindi?",5
Umberto Maggiolini io no e trovo vergognoso chi lo sia......lei perch si permette di interagire con me? Quindi un veterinario  a favore della sperimentazione animale? Lo trovo molto sadico chi li salva e poi li uccide attraverso sperimentazione.....,1
" un post pubblico, quindi posso risponderle, lei parla di sperimentazione come fosse il male senza neppure sapere cosa sia un comitato etico, desumo, e trovo questo atteggiamento davvero vergognoso.
Se non apprezza che le si risponda pu sempre cancellare tutto, cos non sar costretta ad interagire.",5
