text,likesCount
"Io mi chiedo perch una veterinaria si interessi di un caso che non ha seguito e vada in difesa di una clinica ""a caso"". Se non sbaglio ha iniziato lei a fare insinuazioni diversamente Thomas Colussa non l'avrebbe mai considerata avendo ben altro a cui pensare. Sarebbe meglio si concentrasse sul suo lavoro e suoi suoi pazienti per rendere credibile la sua professione anzich perdere tempo sui social giudicando situazioni che non la riguardano.
Io sto dalla parte di Thomas.",0
"Scusate ma in tutto ci, ma mi spiegate che senso ha un record dove ci si trascina dietro un cane in alta montagna? O  forse il cane che gli chiede di andare a scalare? Mi sembra assurdo! Se proprio deve fare un record per soddisfare il suo narcisismo, allora che si porti dietro una bambola gonfiabile in costume cos gli torna anche utile!",5
"Che pena infinita . Sto video sotto al quale mi pare ci siano stati commenti anche da parte di suoi colleghi che la smentiscono . Ah gi.. lei  pi brava di tutti.  Da parte di noi ignoranti che possiedono un animale. Senza avere conoscenze scientifiche ad alto livello   il giudizio sui vari professionisti e fatto in base al risultato ottenuto . chi ti risolve il problema  pi bravo . Magari ne hai girati diversi che ,oltre averti spillato una marea di soldi, nn hanno concluso nulla. Per fortuna di bravi professionisti ce ne sono ancora. Non certo quelli che sputano sentenze con le informazioni avute su fb",1
"fine la verit viene sempre fuori anche quelli di Garlasco che lui  innocente  s per puoi venire puoi essere anche d'accordo con tanti di noi che tanti veterinari pensano pi ai soldi che al paziente e questo dispiace perch comunque il paziente umano oppure canino o chiunque sia alla priorit e anche chi sta dietro il proprio padrone o i familiari hanno il diritto se paghi ha il diritto di sapere le condizioni e tutto quanto perch se io pago un sacco di soldi a un veterinario per salvarmi il mio cane gatto chi sia  giusto che tu mi devi ascoltare e se io ti chiamo mi devi rispondere ed  cos per qua ormai  quasi tutto per i soldi tutto per visibilit per non  giusto perch alla fine le persone gli animali per chi li deve curare  cio non lo so guarda io mi dispiace perch non  giusto che ti hanno minacciato questo  una cosa orribile e non va bene , uno pu anche dire la sua di espressione di libert tutto quello che vuole minacciare no assolutamente per non puoi anche dire lui  un cane che va fatto cos  non  vero perch tante volte i medici a guardare anche cos una persona sbaglia non la diagnosi nessuno  perfetto per carit per  questo anche avete messo menzionato di Garlasco  c' alla fine anche bossetti come Garlasco e tutto sono persone innocenti quanti ce ne sono  l in televisione fanno solo per visibilit  e poi sbagliano tutto e che ci va di mezzo le persone innocenti come anche cos anche numb perch comunque l nella clinica San Marco non  stato curato bene mandato via in quelle condizioni  guarda mi sono incazzata un Cane  mandato via cos perch non avevano voglia ,  ha fatto bene ad incazzarsi Thomas ha voglia ma lui  stato fin troppo bravo io sarei andata la diretta e non ti dico cosa avrei fatto io perch non  giusto poi un cane io  ho una gatta e guai a chi  la tocca  comunque non fate troppe professionisti in tv o sui social fate idea di veterinari dottori o chiunque sia la vostra professione fate seri",2
"Giulia, il problema di situazioni come questa  che toccano le corde emotive di chi le vive e di chi le ""osserva"" andando a stimolare i gi piuttosto presenti bias cognitivi.  la stessa cosa che si vede nei novax o nei novelli vatnik che riempiono i social: nessun argomento, per quanto ben espresso, autorevole e supportato da competenze, potr mai scalfire la cieca ignoranza di certe persone. Per quanto mi riguarda, purtroppo,  tempo perso.",43
A me sembra che chi abbia bisogno di cure sia innanzitutto il padrone,11
"Ma dagli animalisti cosa ti puoi aspettare, mia cara Giulia Corsini?",13
"Anche alcuni commenti deliranti a questo post, notare i profili, dimostrano che purtroppo lanimalismo ideologico  come lambientalismo ideologico, entrambi hanno effetti opposti a quelli auspicati e spesso sono sostenuti dalle stesse persone, magari pure complottari e Novax.

Durante la pandemia ricordo luso del termine veterinaria usato come insulto nei confronti di Ilaria Capua, quando si parlava di un virus che aveva fatto il salto di specie da animale ad uomo ed i veterinari hanno un ruolo importante per le malattie trasmissibili, secondo il modello One Health promosso dallOMS.

Ricordo anche gli animalisti che liberavano i visoni in un ambiente estraneo, condannandoli ad una fine molto peggiore di quella alla quale erano destinati, per non parlare del mantra contro gli allevamenti intensivi, dato che, come per lagricoltura, il contrario di intensivo  estensivo, quindi maggior consumo di territorio e riduzione della biodiversit.

Penso che siano necessari un ambientalismo ed un animalismo radicali ma razionali e scientifici.

Riporto uno stralcio dellappello per la scienza e la competenza, al quale mi auguro che anche Giulia Corsini decida di aderire e dal quale  nata la rivista di divulgazione scientifica www.icosaedro.eu 

https://www.facebook.com/share/1A8kjLNkGK/?mibextid=wwXIfr 

Per agli allevamenti di animali a scopo alimentare, non si pu tornare alla vecchia fattoria delle filastrocche infantili, dobbiamo invece pensare ad allevamenti moderni, tecnologicamente avanzati, che combinino la tutela della salute e del benessere animale, con la necessit di sfamare otto miliardi di abitanti della terra, solo cos si pu ridurre il rischioso uso di antibiotici, che va regolamentato, ma non proibito per legge. E da combattere il cattivo uso degli antibiotici non gli antibiotici, perch non  lo strumento il colpevole, ma lerrato uso che di esso si fa.
Altro discorso riguarda gli allevamenti di animali da pelliccia, che non sono una necessit e rappresentano, anche per le caratteristiche di molte di quelle specie animali, un gravissimo rischio epidemiologico, chiediamo quindi che vengano superati, prevedendo le necessarie riconversioni ed indennizzi per imprenditori e lavoratori di quelle attivit economiche. Quello che  successo in pandemia negli allevamenti dei visoni, deve servire da monito e da guida su come indennizzare chi vive di quella filiera. Le scelte politiche dei piccoli passi non funzionano quando si parla di agenti infettivi semplicemente perch virus e batteri non rispettano le leggi delluomo.

Aggiungo che  anche utile una campagna insistente per la limitazione delleccessivo consumo di carme, soprattutto quella trasformata.",5
Thomas Colussa ma davvero credi che la popolarit per un problema del genere possa essere oggetto dinvidia?& Sbrodolati pure stai tranquillo che in epoca di analfabetismo funzionale (e non&) la popolarit  un concetto molto relativo.,0
Baza De Fen mi sa che parli di te stesso ad ogni insulso commento che fai  altrimenti non si spiega tanta stupidit senza sapere niente,0
Camilla Prevedello usarlo per fare soldi?,0
Thomas Colussa vedere un cuoco che pensa di poter insegnare un mestiere a una veterinaria  uno spasso. ###,1
Stefania Maria Demontis per a differenza tua sa mettere le h al loro posto. ,1
"Sono dislessica,  discalcula,  prima di giudicare,  aziona il cervello,  unendo sinapsi  con neuroni se c' li ai...",0
"Ingrid BalEnjoy brava.  Lo schieramento dalla parte del proprietario di Numb e proprio dovuto a questo.  L identificazione nella situazione. E se cos tante persone hanno avuto questa identificazione facciamo due considerazioni. Per tanti veterinari purtroppo, senza generalizzare ovviamente, la professione  diventata un business non di poco conto. Per fortuna ,rispetto al passato, c  maggior sensibilit da parte dei proprietari, rispetto ai problemi degli animali d affezione. Infatti sono nate diverse cliniche veterinarie che prima nn esistevano. E per fortuna  . Per purtroppo tanti ci marciano. Prezzi esorbitanti, a fronte di problemi non risolti per negligenza.  frequente imbattersi in professionisti che pensano solo ai soldi senza preoccuparsi di fare bene il loro lavoro.",1
"Ingrid BalEnjoy in effetti la lussazione di rotula traumatica rappresenta il 10-15% delle lussazioni totali, il resto derivano da problemi congeniti, e non credo che non far saltare il cane possa migliorare la cosa, stessa cosa per il legamento crociato, oramai definito come malattia degenerativa, un salto pu essere la goccia che fa traboccare il vaso, ma non la causa, ovviamente facendo eccezione per traumatismi importanti.
Questo tanto per dire che la comunicazione non  cos lineare, perch da una parte c chi parla, dallaltra c chi ascolta ma non  detto che capisca.
Sul fatto che la comunicazione debba essere potenziata sono daccordo, ma allo stesso tempo bisogna anche rivedere lapproccio che si ha con i medici dei propri animali.
Per quanto concerne invece la vicenda, trovo abbastanza impari lo scontro tra Thomas e la clinica, in quanto lui pu, fino a che non si andr in giudizio, esprimere opinioni, dare informazioni, mentre noi, ed in questo caso mi metto in mezzo anche io come categoria, non possiamo difenderci, pubblicamente, magari semplicemente pubblicando le cartelle cliniche.",1
Marisa Marveggio ah e il cane in questione non  business per il proprietario? ,0
Bruno Sabia Ma non era la veterinari ad essere offesa? A no!,3
Lollo Romix eh infatti il tuo padroncino nei commenti  assolutamente pacato e ragionevole. Evidentemente dare dell'idiota e del ritardato  una nuova forma di complimento.,2
"Lolletto  da ieri che non fai altro che ruttare.
Forza su, una grappetta e ti passa",3
"Marisa Marveggio un commento solo, veramente. Tutti gli altri colleghi sono perfettamente concordi con la dottoressa.",3
"Giulia Pedra ma si.   . Come in tutte le cose ci possono essere pareri discordanti. Il punto  che trovo inutile questa crociata a favore della clinica in questione da una persona che nn centra nulla. Almeno credo. Sputare sentenze basandosi su informazioni sommarie nn fa certo onore ad un professionista . E tante persone che hanno animali si sono purtroppo trovate con   veterinari che invece di fare il proprio meglio hanno pensato solo di spillare soldi. L empatia verso il caso di Numb rispecchia la realt. Poi tutti noi, compresa la veterinaria che fa il video, per giudicare dovremmo essere  a conoscenza di come sono andati i fatti nella realt .",1
"Marisa Marveggio se due colleghe sostengono che io devo sostanzialmente espormi sulla questione solo sulla base di dati protetti da segreto professionale (mentre i miei colleghi ricevono merda, e non dicono nulla su questo) non vuol dire che tutti i colleghi sono d'accordo. Si guardi bene anche tra i commenti di quelli che supportano la mia analisi che si concentra sulle incongruenze nella narrativa cinica che Colussa fa per fare vetbashing, ovviamente ci sono anche molti veterinari.",2
Giulia Corsini in entrambi gli schieramenti nessuno potrebbe esprimere pareri. I veterinari che nn hanno accesso ai referti e le persone che hanno seguito la vicenda dai racconti di fb. La verit casomai verr fuori nelle sedi opportune. Appunto che questo suo accanimento mi pare fuori luogo.,1
"Marisa Marveggio l'accanimento c' quando dall'altra parte si esprime altrettanto accanimento. I suoi commenti, dietro il tentativo di essere neutrali, sono invece chiaramente di parte.",0
"Elena Romanello guardi. Dalla parte del cane senza dubbio. Per il resto nn conosco il proprietario e vedo quello che vediamo tutti su fb. Non esprimo pareri in proposito.  I miei commenti sono dettati anche dalle esperienze avute con diversi veterinari tra i quali molti incompetenti e disonesti. Ovviamente nn li ho sp....nati su fb , ma nella cerchia delle mie conoscenze nn hanno avuto una buona pubblicit da parte mia ovviamente. Trattandosi di Numb e del suo proprietario  ovvio che la cosa  uscita pubblicamente . E capisco anche tutta la rabbia, non condividendo i modi  . Ma  comprensibile. E poi mi pare di ricordare chi ha cominciato ad attaccare....",0
Barbara SudMilano domanda innocua: ben altro da fare equivale a fare video su articoli di giornate senza essere a conoscenza dei dettagli ?,0
"Marianna Iannazzo in che senso ""saltata su oggi dopo mesi e mesi""? ho visto semplicemente delle incongruenze nella narrativa di Colussa dal punto di vista clinico (incongruenze e falsit usate per attaccare i veterinari che hanno curato iil cane) e lui cosa ha fatto, ha scatenato una shitstorm, allora ho deciso di approfittare della shitstorm per ricostruire meglio la sua vicenda, usando tutti voi per l'engangement del video, in modo che si diffonda la versione dei fatti pi reale.",3
"Giulia Corsini bhe tutto questo mia cara  successo qualche mese fa& cio, lei fa le sue considerazioni dopo mesi?  Lei ,sta approfittando della situazione per parlare di cose che effettivamente non sa visto che ha deciso di parlare e mostrarsi a tutti noi come quella che smascherer Thomas&per le posso dire che un cane buttato fuori da una clinica nelle condizioni di Numb mi sembra comunque un po poco professionale, mi creda ho fatto casino anchio in un pronto soccorso veterinario quando ad una emergenza mi dissero  he signora doveva chiamare prima non so perch dopo poco il mio cane  stato preso in carico& comunque& seguo questo binomio dai tempi di Thomas chef e mi creda& lei di loro non sa assolutamente nulla& e mi chiedo il perch abbia oggi voluto alzare la voce lei parlando di loro non avendo visto nulla di concreto..  e comunque lei anche se dice di essere un veterinario o cose cos mi spiace la REALT dei fatti non li sa nemmeno lei. LA REALT dei fatti la sanno i vet che stanno curando Numb e tutti quelli che lo hanno avuto in carico di sicuro non lei che ha preso pezzi di video qua e l e sta traendo le sue conclusioni& questo si chiama ricerca di like sui social e da un professionista  sicuramente non un buon biglietto da visita mi creda&",0
Pia Cafaro Quindi i cattivi sono quelli pro Colussa. Voi i buoni. Che non siete pro animali e soprattutto non offendete.,7
"Lollo e a lei chi le dice che io sia contro gli animali, abbiamo per caso mai mangiato nello stesso piatto?
Ho avuto sei gatti tutti morti di vecchiaia e la pi giovane di tumore al cuore e metastasi ai polmoni, il maschio mi  morto a 23 anni. 
Lei di me e di come ho trattato i miei animali non sa una benemerita mazza.",8
"Pia Cafaro io sono Animalista e proprio per questo non avrei fatto affaticare il mio animale in presenza di problemi di salute, qualsiasi problema di salute.
Penso si chiami buonsenso.",12
Livi Scl io amo gli animali ed  proprio per distinguermi da questo ammasso di gente che campa sulla pelle degli animali.,5
"Pia Cafaro io credo che Thomas, che seguo da molto tempo, abbia sottovalutato, in buona fede, tutti quanti i problemi, a partire dall'inizio.
Mio modesto parere.",0
"Livi Scl no , non ha sottovalutato, ha sfruttato continuamente per fare 4 soldi. Una persona vergognosa",1
"Baza De Fen bah, pu essere.",0
Dagli animalisti mi aspetto tanto dagli animalari o animalati ben poco,3
"Pia Cafaro Studi l'italiano. Lei definisce animalisti chi segue Colussa. Per si sente toccata nel vivo quando diciamo che siamo Pro  animali e voi no. Siamo animalisti , come dice lei,  si o no ? siamo pro animali  si o no?  Grazie a Dio non la conosco.  Ed  una benedizione.",1
"Lollo Romix grazie al cielo non la conosco io, oramai ho abbandonato questo mondo e sono pi serena, siete solo un ammasso di decerebrati mentali, voi e lammore, pu tutto! #########",1
"Romy Terranella guardi che finora nessun tribunale ha stabilito l'innocenza n di Bassetti, n di Stasi, bens il contrario&@ non sapete distinguere la realt dai social",3
Silvia Benedetti s s come no ma non vedi tutto lo schifo che  uscito fuori  dopo anni  e tu credi che un dubbio alla gente non gli  ritenuto che possono essere innocenti,1
"Romy Terranella signora state dicendo che la dottoressa non pu esprimere delle perplessit sul caso perch non ha visto tutte le carte , e lei esprime delle perplessit sui casi di Bassetti e di Stasi? Non credo che conosca tutta la documentazione sui casi",1
"Mamma mia, allora la denuncia di diffamazione la vuoi davvero.  Mi chiedo con che coraggio, supponenza, prepotenza e migliaia di altri termini, si possa pensare di ""ricostruire"" la storia clinica di un cane, attraverso quattro post di instagram, senza mai aver visto il cane, senza mai averlo visitato, senza mai aver letto una sua cartella clinica. Chi sei? Una che ha la palla di vetro?  veramente bello sapere che, quando Thomas era nella merda pi totale e non sapeva pi a chi affidare Numb, avete fatto tutti fugotto e nessuno si  proposto. Per, per parlare di lui (casualmente nella stessa tempistica d'uscita del tuo libro), neanche di Thomas come persona ma di Numb e della sua situazione clinica, caso strano, siete usciti tutti. E proprio nel momento in cui  stato dichiarato fuori pericolo.
Oltretutto, mi dispiace, ma il paragone con i casi di cronaca nera, con cui lei paragona il fatto di ""poter mettere bocca e dire la propria opinione"", non sussiste, per un semplice motivo: le cartelle cliniche, che siano veterinarie o meno, sono riservate e non credo che qualcuno gliele abbia inviate (contravvenendo alla legge, oltretutto). Mentre, per i casi di cronaca, le cose, sono ben diverse.
Io personalmente, finendo qui poi il mio commento, da un veterinario che commenta un caso clinico come quello di Thomas e Numb, che  lungo, complesso, prendendo solamente informazioni da qualche video sui social e sparando sentenze, non ci porterei mai nessuno dei miei animali.",11
"Spettabile collega, ho seguito attentamente tutto il suo monologo: ottima dialettica, complimenti! Premetto che, nonostante io nutra affetto nei confronti del binomio Numb/Thomas, il mio intervento non  certo volto a difendere alcuno.. anzi, mi aspettavo di sentire, da lei, come preannunciato, prendendo spunto da questo caso specifico, una difesa della nostra categoria che, troppo spesso a torto, ma, a volte, ahim, anche a ragione, viene aspramente criticata! 
Invece, mi sono ritrovata ad ascoltare un video che ripercorre (puntigliosamente) il percorso sanitario del cane, condito, qua e l di pillole di medicina veterinaria, ma che non aggiunge nulla a quello che gi tutti, followers e non, sanno a riguardo.. e questo perch lei ha potuto raccogliere solo il materiale profano trovato in rete: articoli di testate locali, interviste, post Facebook, Instagram e video di tik tok, nulla di ufficiale n tantomeno scientifico.. e qui cade il suo paragone con criminologi ecc.. certo nessuno eccepir nulla alla Bruzzone della situazione (citazione, comunque, a mio parere, infelice, poich non  certo una delle criminologhe che stimo di pi, poich, spesso mi sembra pi asservita allopinione pubblica che allonor di verit, ma questa  unaltra storia).. ma i professionisti del crimine non commentano post di social n
articoletti e interviste pi o meno amatoriali, (almeno non solo), valutano e argomentano dopo aver avuto accesso ad atti, carte, documenti ufficiali& che, nel suo caso, equivarrebbe allaver consultato tutti i referti e le cartelle cliniche del paziente di cui parla& cosa che, per causa di forza maggiore, non pu fare!
Pertanto, il suo discorso mi  parso un gesto volto pi a diffamare e denigrare la persona in questione, toccandolo sul personale, arrivando addirittura ad insinuare che non ami il suo cane, ma lo usi meramente per fini commerciali ed economici, lucrando sulla sua salute& unaccusa piuttosto grave e unosservazione che non mi aspetterei MAI di sentire in pubblico da una professionista (lo pu pensare e dire al bar con le sue amiche, perch  un essere umano anche lei, prima di essere un medico veterinario, ma non mentre riveste un ruolo come questo)! 
In conclusione, dunque, mi  dispiaciuto vedere che lei abbia manifestato lo stesso medesimo comportamento di cui lei accusa il protagonista del suo video: ha voluto semplicemente infangarlo in mondovisione, senza portare nulla in pi a difesa della Clinica San Marco, anzi, se vogliamo, c una indiretta critica al lavoro degli attuali colleghi che si occupano del caso che, a detta del sig. Colussa, hanno sempre autorizzato quello che lei definisce rischio inutile (tornare, in modo controllato, aiutato con dovuti ausili, nei luoghi che sicuramente motivano maggiormente il paziente alla guarigione: la PNEI  un aspetto molto importante, sono sicura che lo sa!)
Detto ci, sono unicamente daccordo sul fatto che lirruzione nella clinica sia stato un gesto infelice e da condannare.. anche se, anche riguardo ci, devo dire che, purtroppo anche per MIA esperienza personale, la comunicazione con i proprietari (che, volenti o nolenti  UNA PARTE DEL NOSTRO LAVORO)  spesso molto carente, imprecisa, insufficiente, spesso causa di forte malcontento e indignazione da parte di chi  gi molto preoccupato e provato emotivamente dalle precarie condizioni del suo animale! 
In conclusione, io credo che ci siano molte criticit nel rapporto medico veterinario/proprietario, ma credo, altres, che non sia un video come questo su Facebook il modo migliore per cercare di migliorarle!
Un caro saluto! Buona Domenica e buon lavoro!",58
"Nel caso specifico la dottoressa non doveva permettersi di dire nulla perche' non e' a conoscenza dei fatti stando al ragionamento di molti ma ricordo a tutti i seguaci di Colussa che anche il vostro beniamino argomenta in maniera colorita fatti di cronaca pubblici. La differenza fra i due quale sarebbe? Prendi un caso pubblico e ci fai su un video o una storia o un reel,fa parte del fantastico mondo dei social.Vuoi non avere a che fare con i commenti? Non esporti.",5
"Ma se non sbaglio,fu proprio lei a scrivere che se ne and dalla clinica San Marco quando fece il tirocinio per insoddisfazione, ad3sso la difende?Se vuole visibilit per pubblicizzare il suo libro, cerchi altre strade e la smetta di parlare per niente. Rimanga in Inghilterra,qui lei avrebbe gi chiuso e per finire, Thomas e Numb,hanno fatto cime straordinarie ben prima dei suoi problemi di salute (causati dalla malasanit veterinaria),e se tutti noi li difendiamo,  perch sappiamo benissimo chi sono,lei invece? Non credo proprio!",8
"Mi ricorda moltissimo quei casi di genitori che utilizzano i propri figli per fini personali, non considerando la loro individualit. Quel cane  stato distrutto da un proprietario che non espande la propria visione ""affettiva"". Questo  a tutti gli effetti maltrattamento.",2
..insomma..mi faccia capire..lei  pi brava di tutti I veterinari che hanno avuto in cura Numb da quando  nato..?..tutti gli altri sono forse incompetenti..?..a me sembra che lei sia un pochino supponente...	,10
"Finalmente!!!
Grazie dott.ssa eO",2
Aggiungo che in una clinica dove ai proprietari vengono chiesti migliaia di euro per le cure mediche evergognoso non avere abbastanza personale TURNISTA ( quindi nessuno 7 gg su 7) da supplire alle emergenze ed altro in modo corretto.,0
"Giulia Corsini  lei sta parlando da veterinario per non vedo il paziente o cartella clinica ,da questa parte del tel.arriva che un veterinario sta spiegando in negativo le azioni del proprietario del cane .in parole povere sta esaminando il cane dai post non mi sembra giusto .da semplice proprietario di un piccolo cane vecchio e ammalato siete quasi una casta",0
"Pazzia allo stato assoluto. Io spero solo che sia semplicemente ignoranza, eventualmente ego sfrenato ed autoproiezione di s stesso nella vita del cane, nella ricerca di quella visibilit e successo non diversamente ottenibile nella propria vita privata. Ma ahim so come, nel mondo assurdo di oggi, fatto di ""influenZer"" che per visibilit e soldi sarebbero disposti a vendersi la madre, figuriamoci un cane, pensare ""bene"" sia alquanto utopico.",9
Giulia Corsini se aprissi un po gli occhi capiresti che la salita fatta (in mia presenza)  stata di pochi metri portando su il cane; prima di dire balle io mi informerei un po meglio!!,16
Matteo Micheletto quel giorno a plateau ros abbiamo fatto una passeggiata con la neve!!,12
"Matteo Micheletto ma lascia perdere che questa non distingue una scalata da una passeggiata sulla neve! Io ero con Thomas e Numb a plateau, abbiamo fatto letteralmente una passeggiata su una neve!",12
"Carlo Costa una passeggiata tirando lo sling sulla pancia, su terreno ghiacchiato e inclinato, e trasportando il cane come se il cane fosse un pacco (si veda video un cui lo tira lateralmente invece di rispettare il movimento), e poi si racconta sui giornali che  stato sul Plateau. Io guardo come l'avete venduta quella passeggiata sui social per i like...",20
"Giulia Corsini comunque sia prima di salire a fare quel pezzettino di passeggiata, sul Plateau Rosa chiese ai suoi veterinari se era fattibile e gli dissero di s . Non credo proprio che Thomas voglia male al suo cane o gli piaccia spendere soldi cos, anzi a me sembra che stia facendo limpossibile per farlo star meglio e fargli vivere una vita dignitosa, avr dei brutti modi quello che volete, ma io ci vedo amore in quello che fa per Numb, non so in quanti avrebbero fatto lo stesso..
E comunque il fatto che ha fatto irruzione nella clinica ha fatto bene, ma alla grande!!!  vergognoso che una clinica non dia notizie, al proprietario dopo tutto quel tempo, mi sembra irrispettoso, come dovrebbe stare scusate?! Mi sembra sia il minimo fare una chiamata. Senza parlare di come lanno spaccato fuori poi.. povero Numbd",10
"Giulia Corsini 
Anche fosse solo una passeggiata (a 3700 metri ) rientra perfettamente nella definizione di sforzo inutile.",4
"Nicole, tu parli dei veterinari che sputtana per caso? Perch loro si occupavano della fisioterapia.",10
