text,likesCount
"Luigi Stantoni continua a non capire il mio ragionamento! Non sto dando torti e ragioni a nessuno, n parteggiando per luno o per laltro!

Sto dicendo che il video proposto dalla collega non  allaltezza DEL RUOLO PROFESSIONALE che riveste! Lo avesse fatto lei, che non  un veterinario, dunque dal punto di vista medico ignorante, sarebbe stato diverso! 
Ma se si vuole investire di una certa valenza alcune dichiarazioni, sfruttando il peso della propria figura professionale, lo si deve fare rispettandola e, dunque, portando a prova certificazioni, testimonianze scientifiche (cosa che non poteva fare, appunto, per il segreto professionale), non contenuti social: su quelli si possono scannare i laici& spero di averle chiarito la mia posizione con educazione! 
buona Domenica :",2
Luigi Stantoni ma lei sa solo rispondere cos? Anche di fronte ad una persona che si  espressa in modo civile.,1
"Paola Cappellin quindi, secondo lei, per forza di cose, chi accusa pu farlo sui social, supportato da followers che sanno meno di niente e spesso si sperticano in offese o peggio e un professionista non pu esprimere perplessit sulla vicenda, basandosi, pure se non sul materiale completo, su documentazione resta pubblica?
O le cose si discutono nelle sedie opportune, oppure ci sta che vengano espressi pareri anche da altri",0
"Silvia Benedetti no! Se la collega avesse espresso le sue opinioni come Giulia Corsini ci poteva anche stare! Ma, avendole espresse come dottoressa Giulia Corsini sottolineando e inserendo le sue competenze (e quindi volendo dare un peso professionale alle sue parole), ritengo che debba farlo con metodo altrettanto professionale quindi avendo sottomano almeno referti e cartelle cliniche se non aver visitato il paziente e soprattutto astendendosi da sentenze personali che esulano dal ruolo specialistico! Invece lo ha fatto solo basandosi solo su contenuti social e, appunto, sprecandosi anche in giudizi morali alquanto infelici e gravi (sempre ritenendoli usciti dalla bocca di un professionista che non deve certo sindacare, almeno non pubblicamente, sulla integrit morale di un proprietario).. Queste sono le mie perplessit da collega!",1
"Paola Cappellin le valutazioni sul caso specifico ci saranno in sede legale tra le parti coinvolte. Qui sui social siamo nell'ambito della divulgazione: un influencer (profano) parla di cose veterinarie, una veterinaria commenta e contesta le sue asserzioni, e lo fa basandosi sul materiale reso pubblico da lui stesso, sul materiale che lui stesso usa (con toni assai polemici) per sostanziare la propria narrazione, le proprie conclusioni e giudizi, e per indirizzare lo sdegno dei follower. Tipo: Colussa accusa la clinica per non aver drenato il sieroma, e noi profani che guardiamo pensiamo: vergognosi, pessimi! Corsini spiega che drenare o meno un sieroma dipende da valutazioni varie e non si fa indiscriminatanente, e chi guarda pensa: ah be'  forse i veterinari potrebbero avere avuto delle ragioni per non drenare, e non sono necessariamentevergognosi e pessimi. O: il proprietario del cane mette in cattiva luce la clinica perch non ha risposto alle sue richieste su come stesse il cane nel fine settimana, e per come ha gestito poi l'interruzione dei rapporti, omettendo o minimzzando i propri comportamenti inappropriati e aggressivi: chi guarda pensa buu veterinari cattivi str0nzi insensibili! Corsini spiega come funzionano le cliniche e ricorda che Colussa pretendeva cose non dovute, e che ha persino cercato di fare irruzione nellla struttura: di nuovo, chi guarda si fa un'idea pi completa rispetto alla versione di Colussa. Questi aspetti li ho trovati interessanti e utili.",2
"Loretta Garbo ma dove la vedete la diagnosi? Anzi, partiamo dalla base: sai che cos' una diagnosi?",3
Loretta Garbo spiegami esattamente dove ho fatto diagnosi e cosa intendi per diagnosi.,3
Giulia Pedra chi non vuole capire ciao ne,0
Loretta Garbo appunto. Non capisci. Non sai cos' una diagnosi. Fine,0
Naomi Visioni Lei sa che per un'irruzione diurna o notturna con danneggiamento intervengono immediatamente le forze dell'ordine? Lo sa vero.,6
"Lollo Romix intervengono se allertate. Funziona cosi nelle cliniche italiane, abbiamo la chiamata rapida ma per usarlo dobbiamo chiaramente essere vicini al tasto. O non aver posato il cicalino per fare una lastra, seguire un'urgenza o movimentare pazienti critici. Se siamo occupati con i nostri pazienti nonch vostri animali durante la notte e non siamo in prossimit dell'ingresso facilmente arriviamo a fatto gi compiuto e probabilmente (probabilmente perch non ero presente come nessuno di voi) vedendo che si trattava di un cliente hanno gestito i medici la criticit senza allertare le forze dell'ordine. Cosa di cui bisognerebbe essere grati. Sempre che poi non abbiano chiesto i danni, cosa pi che comprensibile.",12
"Lollo Romix Lei lo sa vero che nelle cliniche veterinarie non ci sono le guardie come negli ospedali pubblici, quindi il concetto di immediato non  cosi immediato. Lo sa vero.",8
"Naomi Visioni Certo che lo so. Parlo di chiamare con il cellulare o il fisso.  Le aggressioni avvengono negli ospedali , cosa riprovevole, e si ricorre alle forze dell'ordine. Sempre.  Anche in seguito.  Lei lo sa, vero! Buona domenica.",4
"Ripeto, serve il tempo di poterlo fare...invece che apprezzare magari il fatto che non siano state chiamate ancora vi appellate a qualsiasi cosa per dare contro a chi non la pensa come voi. Quindi visto che le forze dell'ordine non sono state chiamate il gesto assume accezione meno negativa? Ma per favore.",5
"Naomi Visioni cosa ti aspetti da gente che lo difende? Probabilmente questa  una di quelle di difende chi va in PS e prende a badilate a sanitari. 
 successa una cosa simile anche a me, anni fa, in clinica di notte. Ovviamente sabato. Arriv un fuori di testa  con cane che stava male da giorni. Per fortuna eravamo in tante ma abbiamo comunque dovuto chiamare i colleghi della chirurgia cavalli. Il tizio quando ha visto che arrivavano di corsa degli uomini (noi eravamo tutte donne),  scappato a gambe levate. La violenza sui sanitari  sempre pi preoccupante",7
"Naomi Visioni io pure quando il discount che vende la mia marca di patatine  chiuso, forzo l'entrata e mi servo da solo. Visto che nessuno ha mai chiamato la polizia, sar tutto a posto cos, no? ",2
Comunque alla San Marco ci sono telecamere dappertutto .. dentro e fuori la struttura (con tanto di cartelli di avviso ) sar stato tutto registrato come le telefonate,1
"Davide Dellagnello guarda, se capita la seconda gravidanza risolver cos le voglie notturne #",2
"Giulia Pedra ma parlano senza sapere. Non hanno idea di cosa sia il nostro lavoro, men che meno notturno.",3
"Grazie Giulia Corsini
Finalmente qualcuno che ha preso forza coraggio e soprattutto tempo per poter spiegare bene tutto quel che quella brutta persona sta facendo al SUO cane e alle persone.
Ma come dici tu purtroppo ci saranno i suoi fan vedranno cose inesistenti su quello che lui racconta dove non esista alcuna verit!!!!!
Grazie davveroO",1
"Non so chi abbia ragione, ma la mia veterinaria che nonostante conosca benissimo il mio cane, quando lo stesso ha un problema di salute e provo a spiegarglielo al telefono, mi interrompe dopo poco e mi dice ""portalo che lo devo vedere!""
Io non so come si possa fare una diagnosi e dare un giudizio a distanza su un paziente che non conosce e non ha neanche mai visitato.",1
Solo una domanda: ma la Clinica San Marco non ha un avvocato??? A che titolo questa vet si arroga il diritto di parlare a suo nome?  una consulente esterna??? O cosa???,5
Carissima dottoressa  non penso che una possa fare diagnosi senza aver visitato .....io non mi fido di persone che fanno diagnosi solo per aver visto social e come padrona di cani ho scelto veterinari seri che per social o telefono non fanno diagnosi ....lei   in Inghilterra  come fa a dire alcune cose lei sa come viene trattato usato o come voglia il cane dal proprietario?  Buon lavoro,1
Io penso solo che la sig fosse una professionista&.. il suo contributo avrebbe dovuto darlo prima no quando Numb per fortuna  guarito e direi che il pi bel tacer non fu mai scritto,2
"Portalo in tribunale e ""pettinalo""per bene  cos gli fai passare quel ghigno che ha sulla faccia.....",3
"Boh ... L unica cosa sensata che riesco a portare a casa  che chi sta con Colussa riporta addirittura le stesse parole che usa lui nei video, senza nemmeno cambiare la punteggiatura (e gi qua mi farei 2 domande), chi invece sta con la dottoressa usa un linguaggio pi forbito e raffinato ... Poi c  chi commenta alla c**** di cane (cos si rimane in tema) accusando chi l uno, chi l altro, senza aver capito nemmeno una parola del video della dottoressa.
Poi c  chi offende a spada tratta perch, boh non so nemmeno io perch  sempre necessario offendere!
Detto ci, alla fine chi vincer?
Per ora e per fortuna ha vinto la vita e domani  un altro giorno ... 7",2
"Il cane,  STATO FERMO SETTE MESI, prima dell'ernia....che cavolo sta dicendo, per la miseria..1",7
"Fra l'altro oltre ad avere un ego gigantesco( evidentemente foraggiata dall'ignoranza)  pure misogino, come pochi.DD.",2
Quante volte hai pubblicato questo video . Hai bisogno di visibilit? Sei patetica . Parla dei tuoi pazienti se li hai e non di cose che non sai solo perch sentiti sui social . Io una veterinaria che parla solo perch ha sentito sui social senza aver visto il paziente e senza un referto in mano  da stare alla larga . Brutta cosa l' invidia,1
"Francesca Violi  proprio qui la differenza di opinioni tra me e lei.. la collega non dovrebbe, secondo me, commentare, rivestendo il ruolo di dottoressa, per deviare lopinione pubblica a favore della sua tesi perch, la stessa, non  fondata su quelle basi solide che richiede unargomentazione da medico veterinario.. lei stessa, da professionista, non ha potuto verificare nulla e pertanto non pu asserire con certezza nulla sul caso specifico (le sue spiegazioni possono essere pillole di medicina veterinaria generali, fini a se stesse, ma non INEQUIVOCABILMENTE riferibili al caso in questione)& lavesse fatta da signora (o signorina) Giulia Corsini sarebbe stato diverso, ma sarebbe stata una delle tante opinioni pendenti pi da una parte piuttosto che laltra! 
Inoltre, ancor meno professionalmente, si  permessa di dare giudizi sulla condotta morale del proprietario (se lucra o meno sulla salute del suo cane non  una questione medica che cambia la diagnosi, la prognosi e la terapia), nonch ha, nemmeno tanto velatamente, offeso tutti i followers del sig. Colussa, dichiarando di non considerarli, probabilmente, in grado di comprendere il suo discorso.. e allora mi chiedo a chi stesse parlando: avevo inteso che volesse aprire gli occhi proprio a costoro! O magari desiderava solo ricevere gli applausi di chi gi la segue e la stima? Non so.. ho tanti dubbi sulla bont di questo video che, a mio parere, ha fortemente disatteso le intenzioni che andava millantando e lascia invece un retrogusto di odio e antipatia (proprio ci che rimprovera al suddetto)!
Buona Domenica :",4
"Paola Cappellin non vedo perch non pu fare le sue osservazioni in quanto veterinaria, a maggior ragione le pu fare .
Ma mi sembra che il signore abbia offeso anche il presidente della provincia di Trento, senza nessuna carta alla mano, e i follower sono anni che offendono il presidente e noi trentini, senza sapere nulla. Ma in quel caso nessuno ha alzato le mani dicendo ""oh non abbiamo visto le carte"". La verit  che c' un difesa col paraocchi, punto.",0
Francesca Violi invece siamo al paradosso. Per taluni un profano pu parlare di cose veterinarie e infangare sui social mentre un veterinario non pu fare degli appunti sulla vicenda.,0
"Silvia Benedetti continua a non capire il fulcro del mio discorso! Non importa, me ne far una ragione! Buona Domenica :",0
"Paola Cappellin capisco il tuo punto di vista... Per chi se non un veterinario pu contestare allora? Se lo faccio io che sono una profana, la mia  solo un'opinione come tante. Non ti sembra paradossale questo modo che auspichi tu? Dove a chiunque, anche con palese conflitto di interesse concreto e morale, in wuanto parte in causa,  concesso di dire la sua, mentre chi  competente, di fatto non potrebbe commentare n mettere in discussione una narrazione, per quanto viziata, scorretta o distorta?",0
"Paola Cappellin l'ho ben capito il fulcro del discorso. Ma un discorso del genere a mio avviso viene a decadere quando si parla pubblicamente sui social della vicenda , facendo nomi e cognomi. A quel punto non vedo perch un veterinario non possa esprimere le sue perplessit a favore dei colleghi . Anche perch il materiale pubblico non era poco: radiografie, foto, video, racconti del padrone.",0
"Francesca Violi assolutamente! In democrazia ognuno pu esprimere le proprie idee! 

Non ho detto che la collega NON POTEVA esprimere il suo parere, ho detto che, secondo me, NON AVREBBE DOVUTO in veste di professionista, perch mancante di troppe informazioni per essere credibile al 100% e, pertanto, offre lennesima visione incompleta e dubbia della questione! 

Inoltre, la cosa che ritengo pi deplorevole,  che, sempre nel ruolo di professionista (e quindi gi con i limiti sopra citati), non si  limitata a commentare e mettere in discussione una narrazione, per quanto viziata, scorretta o distorta, ma ha avanzato pesanti giudizi sulla relazione del proprietario e il suo cane e ha apertamente offeso tutti coloro che lo seguono! Non ti sembra un atteggiamento che possa avere come unico risultato quello di irrigidire ancor pi ognuno sulle proprie posizioni, anzich quello di invitare ad avere una visione pi obiettiva, imparziale, realistica e senza pregiudizi? 
Praticamente accusa luno di qualcosa che poi si ritrova a fare lei 7@",1
"Silvia Benedetti il materiale non era sufficiente per esprimere un parere medico attendibile n a favore n contro colleghi! 
Se commenti in veste di medico veterinario, perch in virt di questo vuoi che tutti ti credano, lo devi fare su elementi e documentazioni mediche, non su reel, interviste, post e video social& 
Questo , che piaccia o meno! 
E non ha semplicemente espresso perplessit, ha chiaramente espresso forti giudizi anche sulla sfera personale.. cosa da cui, converr, con me, un professionista degno di questo nome, dovrebbe astenersi dal fare in pubblico!",0
"Paola Cappellin sbagli di grosso, l'antipatia non  verso la persona ma verso quello che dice e come lo dice. C' una bella differenza. Persone e personaggio sono cose diverse. Non vedo dove deduci che ci siano intenti ""peritali"" quando mille volte vengono messi dei punti di domanda e semplicemente si vuole far capire che ci che viene presentato come malapratica invece potrebbe non esserlo affatto!",0
"Janis Valincich no,  possibile che sbagliamo entrambe al massimo& perch lantipatia e i giudizi sono personali, non su come e cosa dice.. insinuando che lui non ami il suo cane ma tutto sia finalizzato a monetizzare (cosa che, comunque, in quanto medico veterinario, non le deve interessare).. inoltre, se da una parte dice di voler aiutare gli annebbiati dallemotivit toccata ad arte dal Colussa, dando una visione obiettiva (cosa che non fa perch non ne ha il materiale necessario), dallaltra offende gli stessi dichiarandoli, probabilmente, non abbastanza in grado di capire il suo discorso& tutti atteggiamenti, sempre a mio avviso, poco confacenti ai suoi titoli che premura subito di sottolineare e che, in fin dei conti, la assimilano (se non fosse che usa una dialettica pi raffinata ed elegante) n pi n meno al personaggio che tanto critica!",2
"Ingrid BalEnjoy no, perch gli inglesi sono mediamente pi intelligenti degli italiani.",11
"Naomi Visioni mettiti al suo posto e poi me lo racconti !
Facile parlare senza indossare le scarpe altrui paso dopo passo",0
Francesca Annalisa Giacopelli ma che cosa stai dicendo per favore. Se arrivate a giustificare la violenza siete messi male.,1
Giampaolo Grisli E Thomas Colussa non lo ! Non  un influenzzerr!,2
"Giampaolo Grisli hai preso troppo sole in testa, metti un cappellino prima di avere danni irreparabili. Ah no, troppp tardi ",4
"Anna Giorgi si, guaritissimo #Ma perch poi dovrebbe essere la DOTTORESSA (NON signora) a spendere tempo e soldi per un cane non suo? Perch devono sempre essere i veterinari a rimetterci tempo e soldi per proprietari cafoni e arroganti?",4
"Giulia Pedra con tutto il rispetto per la Sua professione. La frase che i veterinari sempre perdono soldi ..scusi ma in 60 anni di animali al mio attivo e quindi di veterinari. Mai e poi mai ne ho visto 1 che ci ha perso soldi. Ne ho visti di pi o meno onesti. Questo si  ma a perderci soldi anche no. Diciamola tutta che la vostra  una categoria utilissima ma che troppo spesso specula sul fatto che ognuno vorrebbe il.meglio per il proprio animale e che spesso nn bada a spese. Non entro nel merito della vicenda in questione perch io come la maggior parte di chi commenta, nn ho gli elementi per giudicare se nn ci che visto su fb. Ma credo che lo schieramento verso Numb   rispecchia le esperienze negative che tanti hanno avuto con i veterinari.",0
Anna Giorgi guarito da cosa esattamente?,2
Giulia Corsini teoricamente dall infezione credo intenda ... Perlomeno per ora xch nella mia ignoranza credo ci potrebbe essere una recidiva ma ci auguriamo proprio di no ...,1
"Giulia Pedra Chiedo scusa ma questo commento  veramente di brutto gusto! Le ricordo che  stiamo parlando di esseri viventi a prescindere, e nn  mai tempo perso per aiutare qualcuno in difficolt a prescindere
Per me sta rispondendo troppo a tutti i commenti e ha solo adrenalina da smaltire
Si blocchi un po' e stacchi ...",1
Giulia Corsini  dal sieroma trascurato che  sfociato in infezione e che dopo 2 mesi di antibiotico pesante  risolta. Credo che questo sia il fulcro della questione contestata alla famosa clinica  . Sempre sulla base delle informazioni che tutti noi ha visto su fb.  Lei compresa.,0
Giulia Pedra signora&.. non merita nemmeno una risposta&.. pace a lei,1
Giulia Pedra signora&. Il pi bel tacer non fu mai scritto!  E pareri da lontano &. Non chiesti andrebbero risparmiati e prima di parlare di Numb lavatevi la bocca con ipoclorito di sodio puro,1
Giulia Corsini non  lei il dottore???? Visto che ha fatto questo bel video dovrebbe saperlo.,0
Marisa Marveggio evidentemente di medici veterinari ne conosce pochi,0
Alessandro Mazzocchetti ma perch non siete in grado di capire che non ha fatto una diagnosi? Ha semplicemente letto e spiegato i documenti messi in rete dal proprietario,5
Alessandro Mazzocchetti ti fa il triage e domande per sapere quando prenotare l'appuntamento? Spiegami ora esattamente dove ho fatto una diagnosi e cosa intendi per diagnosi.,1
"Giulia Corsini Qui leggo una diagnosi, parla di ernie e di artrite.
E anche dei giudizi sull'operato di Colussa.",0
"Alessandro Mazzocchetti non ha fatto lei diagnosi di ernie e artrite (non artrosi,  una cosa diversa), sono infomazioni riportate nei video dal padrone del cane",1
"Giulia Corsini be.  Ad essere pignoli .""  Normale ferita chirurgica ""  parole sue quando parla di una foto comparsa su fb .mi pare gi fare diagnosi.",2
"Alessandro Mazzocchetti non sono state diagnosticate ovviamente da me, lui dice (e si comprende da sito chirurgico) che il cane ha subito due interventi per due ernie. La diagnosi si fa con la risonanza magnetica. Il cane ha ricevuto una diagnosi di poliartrite autoimmune (qui ovviamente specifico che  quello che lui dice, non avendo alcun elemento sull'indagine diagnostica eseguita, ed essendo la diagnostica molto articolata per questa condizione). Il sieroma  evidente dalla foto pubblicata.",0
Marisa Marveggio hai visto il video?,1
Giulia Corsini ho letto anche il suo primo post. Riportato qui sopra . Dove scrive che lei da una foto ha visto  una normale  ferita chirurgica . E poi si dilunga in spiegazioni sul sieroma.,0
Giulia Pedra no no ha fatto una diagnosi non richiesta per altro un analisi non richiesta punto !,0
"tu sostieni che il cane sia stato fermo dal 21 luglio 2024 al 21 febbraio 2025 (quando ha avuto l'ernia)
Dal video pubblicati non risulta
ne pubblico un paio
(presi a random, quindi immagino con una ricerca approfondita si trovi di pi)
https://www.facebook.com/permalink.php?story_fbid=pfbid02TUqCwgT9bqZHHz2CK3EfSWk9zUgdkZGSkZahdL3b9tKoEVv8fxkXTvZQ66Ehi9bkl&id=100086254283753

https://www.facebook.com/permalink.php?story_fbid=pfbid0HxLeEqnaFWyWBLXzr3y4V3Xzpgusyv1f9BQSr2GnNe1W1qLLVyf3DPqxABwHvxmbl&id=100086254283753

https://www.facebook.com/reel/1165980921806488/

https://www.facebook.com/reel/597001633253529/

Non capisco bene cosa si intenda per ""fermo"", si intende per caso che non viene portato a scalare il monte Bianco?",11
"Giulia Corsini hanno gioco facile perch i loro , o non seguono con le dovute accortezze , e mettono like a prescindere o hanno la memoria che sparisce il tempo di tre post , poi non fanno ragionamenti logici , ascoltano ci che poi gli viene detto di capire ed ecco che settimane diventano anni , e via dicendo.",6
Giulia Corsini ma non ti sorge il dubbio che i video possano essere registrati e pubblicati in un secondo momento? Chiedo per un amico.,1
Giuseppe Orlando ma tu che ne sai? Ah gi... Sei un fake creato adesso per difenderlo,4
Giuseppe Orlando scrisse il profilo inesistente,0
Giuseppe Orlando mi saluti l'amico timido,0
Romy Terranella lo sai vero che la tua maestra delle elementari si  appena suicidata? &,16
Viviana Basello a te invece ti  suicidato il cervello come al solito i commenti idioti che non capite un c**** poi se non hai un animale cosa puoi capire non puoi capire un c****,3
"Romy Terranella ti sbagli, io ho un cane e una gatta che amo e rispetto moltissimo.
Sono curati e seguiti dal loro dottore e amatissimi in famiglia ",0
Viviana Basello anch'io ho una gatta ed  curata anzi viziata ma sono contenta   per devi dire che tanti veterinari non sono bravi e mi avrebbero anche gi ammazzato il mio cane ancora prima se non avrei cambiato veterinario comunque va bene cos :,0
"Romy Terranella per fortuna sua e sfortuna nostra Giulia lavora in Inghilterra.
Io, essendo anche sua corregionale sarei stata felicissima di affidarle i miei pelosi.",0
Viviana Basello ognuno  libero di fare quello che vuole nella sua vita ma comunque un veterinario un dottore chiunque sia al dovere di prendersi cura del paziente non di fare quello che hanno fatto Al povero numb come ha tanti altri cani perci va bene hanno studiato siete veterinari e allora ha fatto il vostro lavoro senza stare l con i soldi soldi e tutto fate il vostro lavoro,0
"Romy Terranella tu hai solo la versione del tuo eroico possessore di Numb.
Comunque stai e state sereni perch ne risponder nelle sedi opportune ( compresa la denuncia che parte anche dalla dottoressa Corsini) 7",1
Guarda che numb non  possesso di nessuno perch Thomas ama quel cane perch senn non avrebbe fatto ho speso tutti i soldi per guarirlo e l vuol dire che  amore non possesso e comunque la carta canta se voi pensate di essere Dio scesi in terra perch siete chiss cosa avete proprio sbagliato e voi ve la prendete con lui solo perch  l'unico o come tanti altri che riesce a dirgli le cose in faccia come stanno e non ha paura di dire quello che pensa e purtroppo c' altra gente che purtroppo non riesce ma fa male dovrebbe dirvi le cose per in faccia perch se uno sbaglia sbaglia  umano per carit ma  sbagliato chiaro poi si vedr vediamo chi avr ragione e comunque Thomas e numb a me piacciono indipendentemente da quello dei social o che cosa perch vi dice le cose in faccia se vedeva deve mandare a quel paese qualcuno lo fa e fa bene cos bisogna fare che le persone devono reagire,1
"Romy Terranella ripeto, esiste anche l'amore malato",1
"Romy Terranella non ama , sfrutta quel cane . Se manca il cane mancano pure i soldi",2
Marinella Cecchini una.,4
E cosa vorrebbe dire? Sei patetica punto. Una storia chiusa e la tira ancora fuori solo per farsi vedere. Sarebbe stato meglio non parlarne proprio,1
"Marinella Cecchini si chiamano condivisioni: il video  stato ricondiviso, per questo lo vedi pi volte. E dubito che potresti permetterti di portare il tuo pet da un veterinario che lavora nel Regno Unito, per cui il tuo ""stare alla larga"" fa ridere due volte.",1
Una veterinaria che parla di un paziente a distanza senza vedere il paziente e senza vedere un referto  da stare alla larga anche se vivessi in Regno Unito .  lei che fa creato la polemica . Stava a fare i cavoli suoi e tutto questo non sarebbe successo. Se un personaggio non mi interessa non lo seguo e non lo critico,1
Marinella Cecchini  quindi in base a questa logica tra colleghi non si pu discutere di un caso clinico perch non direttamente coinvolti? Andiamo bene ,1
Se non si leggono referti no perch si parla del nulla,0
"Il senso di questo video? Voleva salvare il mondo, la clinica veterinaria, i veterinari in generale, i proprietari di cani? Chi?#utilissimo davvero, credo la candideranno al Nobel ",9
" bizzarra anche la sua cronistoria su Numb, visto che lei fa delle affermazioni errate.",0
" sempre comunque la sua versione contro quella di Thomas Colussa il tutto si vedr nelle sedi opportune. Ritengo molto strano il suo intervento dopo mesi di silenzio sul fatto , ho quasi il sospetto che sia uno strumento comunicativo pianificato.
Non  solo pura informazione come vuole fare intendere. Tutto molto strano.",6
